<?xml version="1.0" encoding="utf-8"?>
<!DOCTYPE transfer PUBLIC "-//XMLmind//DTD transfer//EN"
"transfer.dtd">
<transfer
><section-def-cats
><def-cat
n="c_adj"
><cat-item
tags="adj"
></cat-item
><cat-item
tags="adj.*"
></cat-item
></def-cat
></section-def-cats
><section-def-attrs
><def-attr
n="a_nbr"
><attr-item
tags="sg"
></attr-item
><attr-item
tags="pl"
></attr-item
></def-attr
></section-def-attrs
><section-def-lists
><def-list
n="l_mylist"
><list-item
v="stuff"
></list-item
></def-list
></section-def-lists
><section-rules
><rule
comment="my comment"
><pattern
><pattern-item
n="c_adj"
></pattern-item
></pattern
><action
><out
><lu
><lit-tag
v="pl"
></lit-tag
></lu
></out
></action
></rule
></section-rules
></transfer
>
